{
  "$schema": "../../bflat-manifest.schema.json",
  "schema": 2,
  "name": "pal",
  "description": "Deterministic OS surface, bump allocator, FP-free stdio",
  "note": "What differs between the zkVMs is not here: the guest's exit, its console and raw syscalls go to the zkvm_platform_* functions that the entry object of the platform defines (see the platform interface in docs/manifest.md), and the wraps for one platform are in its package. The accelerator arenas (ZK_ACCEL_ARENA) wrap functions of the zkVM accelerator standard; the bindings manifest of a package decides which ones.",
  "sources": [
    {"file": "module.c", "when": {"arch": "riscv64"}},
    {"file": "module.c", "output": "module.rv32.o", "when": {"arch": "riscv32"}}
  ],
  "objects": [
    {"file": "module.o", "group": "whole-archive", "order": 60, "when": {"arch": "riscv64"}},
    {"file": "module.rv32.o", "group": "whole-archive", "order": 60, "when": {"arch": "riscv32"}}
  ],
  "link": {
    "wrap": [
      {
        "symbol": "getenv",
        "note": "Process/environment identity stubs for the OS-less guest; getenv is the config tunnel (invariant globalization & co)."
      },
      "getcwd",
      "getpid",
      "getegid",
      "geteuid",
      "sched_getaffinity",
      "sched_getcpu",
      "sched_yield",
      "open",
      {
        "symbol": "__libc_malloc_impl",
        "note": "The downward bump allocator - the only memory in the guest."
      },
      "__libc_realloc",
      "__libc_free",
      "calloc",
      "__malloc_allzerop",
      {
        "symbol": "aligned_alloc",
        "note": "Aligned allocation: musl's aligned_alloc/memalign walk mallocng chunk metadata the bump heap never writes, so route them through the bump allocator too (SystemNative_AlignedAlloc is the runtime-startup caller)."
      },
      "posix_memalign",
      "memalign",
      "mmap",
      "munmap",
      "mlock",
      "munlock",
      "mlockall",
      "munlockall",
      {
        "symbol": "pthread_create",
        "note": "No threads, no signals, no time, no syscall passthrough oddities."
      },
      "pthread_sigmask",
      "sigaction",
      "signal",
      "__clock_gettime",
      "clock_gettime",
      "syscall",
      "sysconf",
      {
        "symbol": "PalGetMaximumStackBounds",
        "mangled": "_Z24PalGetMaximumStackBoundsPPvS0_",
        "note": "The real PalGetMaximumStackBounds aborts under static musl on RISC-V (mremap EINVAL); report a synthetic 8 MiB window instead."
      },
      {
        "symbol": "vfprintf",
        "note": "A small vfprintf for the conversions that the runtime's diagnostics use: keeps musl's full printf state machine and its float formatter fmt_fp out of the link."
      },
      {
        "symbol": "vfscanf",
        "note": "musl's scanf/float-parsing members (vfscanf.o, floatscan.o, fmodl.o). The only callers are the cgroup probes, which cannot open their files on a zkVM, so EOF is the correct answer. Redirecting every reference keeps those members out of the link entirely."
      },
      "__isoc99_vfscanf",
      "__floatscan",
      {
        "symbol": "exit",
        "note": "musl exit()/_Exit()/abort() issue exit_group (syscall 94), which a zkVM does not treat as program end; end the guest through zkvm_platform_exit, which the entry object of the platform defines."
      },
      "_Exit",
      "abort",
      {
        "symbol": "__stdio_write",
        "when": {"flag": "no-console"},
        "note": "Hide musl's stdio write path on the real zkVMs; the sim keeps host stdio. The unwrapped one issues a raw writev - harmless on ZisK, which emulates Linux syscalls, but a hard error on SP1 (unknown syscall id) and unserviced on OpenVM, which has no ecall handler at all. Managed console output does not go through it anyway: it takes the SystemNative_Write wrap in rhp, so nothing is lost."
      }
    ]
  }
}
