{
  "$schema": "../../bflat-manifest.schema.json",
  "schema": 2,
  "name": "nofp",
  "description": "FP trap stubs and the libm wrap surface for FPU-less guests",
  "note": "The zkVM platforms link these wraps. The stock musl target also links module.o (bflat.csproj puts a copy in lib/linux/riscv64/musl), but without the wraps.",
  "sources": [{"file": "module.c"}],
  "objects": [{"file": "module.o", "group": "early", "order": 10}],
  "link": {
    "wrap": [
      {
        "symbol": "acos",
        "note": "libm: divert the math surface referenced by the runtime (MathHelpers.cpp RhpDbl* helpers, GC allocation sampling) to the nofp trap stubs. The bundled musl is built rv64im, so its implementations would link and run correctly - the point is that a transcendental has no business inside a proof, and a guest that reaches one is a bug worth hearing about. fmod and fmodf are deliberately NOT here: they are the C# % operator on double and float, ordinary arithmetic the language defines, and musl's are integer-only."
      },
      "acosf",
      "acosh",
      "acoshf",
      "asin",
      "asinf",
      "asinh",
      "asinhf",
      "atan",
      "atanf",
      "atan2",
      "atan2f",
      "atanh",
      "atanhf",
      "cbrt",
      "cbrtf",
      "ceil",
      "ceilf",
      "cos",
      "cosf",
      "cosh",
      "coshf",
      "exp",
      "expf",
      "floor",
      "floorf",
      "fma",
      "fmaf",
      "log",
      "logf",
      "log10",
      "log10f",
      "log2",
      "log2f",
      "modf",
      "modff",
      "pow",
      "powf",
      "sin",
      "sinf",
      "sinh",
      "sinhf",
      "sqrt",
      "sqrtf",
      "tan",
      "tanf",
      "tanh",
      "tanhf",
      {"symbol": "scalbn", "note": "musl fmt_fp dependency, see nofp module"},
      {
        "symbol": "asprintf",
        "note": "asprintf is referenced only by the PAL's CGroup CPU-limit parsing, which cannot open its /proc//sys inputs on zisk (pal's open() returns -1). The stub returns -1 (the documented asprintf failure mode) and, more importantly, keeps musl's vasprintf/fmt_fp/scalbn members - hard-float F/D code - out of the link."
      }
    ]
  }
}
