{
  "$schema": "../../bflat-manifest.schema.json",
  "schema": 2,
  "name": "rhp_native",
  "description": "GC write barriers reduced to the bare store (uGC has no card table)",
  "note": "uGC has no card table and never collects, so every GC write barrier reduces to the bare store. These are the hottest helpers in the image (hundreds of call sites).",
  "sources": [
    {"file": "module.S", "when": {"arch": "riscv64"}},
    {"file": "module.S", "output": "module.rv32.o", "when": {"arch": "riscv32"}}
  ],
  "objects": [
    {"file": "module.o", "group": "whole-archive", "order": 50, "when": {"arch": "riscv64"}},
    {"file": "module.rv32.o", "group": "whole-archive", "order": 50, "when": {"arch": "riscv32"}}
  ],
  "link": {
    "wrap": [
      {"symbol": "RhpAssignRefRiscV64", "when": {"arch": "riscv64"}},
      {
        "symbol": "RhpAssignRefRiscV32",
        "when": {"arch": "riscv32"},
        "note": "The unchecked barrier carries the architecture in its name; module.S assembles the one of its target."
      },
      "RhpCheckedAssignRef",
      "RhpByRefAssignRef",
      {
        "symbol": "RhpAssignRef",
        "note": "The non-RiscV64 name. Guest scans show zero references to it; it stays as insurance until a full workload confirms that it is dead."
      }
    ]
  }
}
